,id,cathegory,author,title,Publish date,url,article_content,images descriptions
6,7,Climate change,Becky Morton,Climate change: How can renters make their homes warmer and greener?,2021-12-18,http://www.bbc.com//news/uk-59223081,"Making the UK's ageing housing more energy efficient will be key to the country reaching its climate targets - but campaign groups representing renters and landlords say more action is needed to drive improvements.
""At one point you could see your breath in the living room it was that cold,"" says Erin Davy. 
The 29-year-old was renting a two-bedroom flat in Melbourn, Cambridgeshire. 
The letting agent had given an estimate of around £80 a month for the electricity bill. But when she moved in, her direct debit ended up being just under £200 a month - and over winter her monthly bill soared to as much as £400 a month. 
""Privately renting now is so expensive for young people as it is. Just the rent, let alone having a massive energy bill on top of it,"" she says. ""It was crippling."" 
Erin's boyfriend had lost his job at the beginning of the pandemic so the couple were relying on her wage alone to pay the bills - and she had to increase her overdraft to cover it. 
The ballooning costs meant they had to be careful about when to turn the heating on and rarely used the living room because it was so difficult to heat. 
After asking their landlord to take action he replaced their old storage heaters with newer models - but it didn't help. The problem was the flat didn't seem to stay warm at all. 
As a converted outhouse, the building was badly insulated, especially the floors and walls. 
Poor insulation doesn't just mean higher bills for renters - it also has an impact on the environment. Heating buildings contributes to almost a quarter of all UK emissions and the more heat that escapes through walls and roofs, the more energy is wasted. 
For Erin, things got so bad that she asked for an inspection by the council's environmental health team who found the inadequate heating was a health and safety hazard. 
But the more she asked their landlord to make improvements, she says, the less responsive he became. Eventually the landlord served them with an eviction notice, saying he wanted the flat back for his own use. 
Erin says the experience of being evicted was ""horrible"" but they managed to find somewhere else to live. 
""We couldn't have stayed there - we couldn't afford it,"" she says. ""I couldn't have done another winter in a freezing cold house.""
If you think your energy bills are too high or your home isn't staying warm, the first thing to do is check its energy performance certificate (EPC) online, says Dan Wilson Craw, from campaign group Generation Rent. 
Buildings are graded between A - the most energy efficient - and G. In England and Wales, homes must have a rating of at least E to be rented out, with only limited exemptions. The government has also consulted on raising the minimum standard to band C. 
In Scotland, the government plans to require privately rented properties to have a rating of at least C from 2025. 
Damp or mould is another sign that your home may be poorly insulated. 
There is government advice available online on how to make your home more energy efficient, which Mr Craw advises renters look at before approaching their landlord. 
But if landlords refuse to take action you can ask the local council to carry out an inspection. Councils are responsible for enforcing health and safety standards of homes and if they find serious issues with damp or heating, they can force the landlord to make improvements. 
Mr Craw says there are also grants and funding available through some councils and energy companies to help make your home more energy efficient if you're on a low income. 
However, research by Generation Rent suggests many renters are reluctant to demand or invest in improvements because they are unsure whether they will live in a home long enough to benefit from the cheaper bills. 
Others may be worried that if their landlord does pay for improvements, they may increase the rent to recoup costs or even evict them. 
Mr Craw says government plans to abolish section 21 ""no fault"" evictions, which would prevent landlords evicting tenants without good reason, will help give renters more certainty about how long they will be living somewhere. 
Generation Rent also supports raising minimum energy efficiency standards for rented homes - and wants tenants to be able to claim back rent if landlords break the rules. 
And the group wants to limit the amount landlords can increase rent for existing tenants to wage inflation, to avoid them upping the rent if they are forced to pay for improvements. 
For landlords, the main barrier to making improvements is cost, according to Chris Norris, from the National Residential Landlords Association. 
Nearly one in five households in England live in the private rented sector, but this type of housing tends to be older and more difficult to insulate. 
The average cost of bringing a privately rented home up to EPC C standard is £7,646, according to the government. 
And while landlords must pay for any changes to their property, they generally don't see the benefits of lower bills. 
Mr Norris says the grants available are quite limited. 
The government recently announced grants of £5,000 would be available to people in England and Wales from next April to replace their gas boilers with low-carbon heat pumps, to help cut greenhouse gas emissions. 
But heat pumps can cost between £6,000 and £18,000 - not including any expensive new insulation that may also be needed - so the subsidy would not cover the total cost. 
As well as more generous grants, the association also wants to see tax deducted from spending on energy efficiency to give landlords an extra financial incentive. 
With gas prices surging, Mr Craw says making homes more energy efficient is even more urgent. 
""If you could address it, you can improve standards of life for private renters and cut carbon emissions,"" he says. ""But it requires action from the government to do that.""
Hayley Pearce chats terrible Christmas gifts...
Follow the true story of one man's struggle to find out why his home disappeared","['Infographic showing five energy-efficient measures people can adopt to save energy', ""Team GB's Laura Kenny in the Tokyo velodrome"", 'Mohammed holding a magazine', 'A still image shows a frame from a video commercial for the Norwegian postal service ""When Harry Met Santa"", which features a gay Santa Claus', 'US vaccine protests', 'The army has been repeatedly accused of excesses by locals', 'Zepeto', 'Frank Mill', 'Trump speaks at a rally in July 2021', 'Man holding phone', 'Presents', 'The House That Vanished']"
7,8,General,BBC News,,2021-12-17,http://www.bbc.com//sport/av/motorsport/59703165,"This video can not be played
JBXE owner and driver Jenson Button tells BBC Sport how Extreme E has been helping to raise awareness of climate change.
READ MORE: How motorsport can lead to cleaner mobility
Follow the last race of the season in Dorset across the BBC Sport app and iPlayer this weekend.","['Jordan Henderson', 'Wonderkids Episode 2: Jude Soonsup-Bell', 'Thomas Tuchel', 'Emma Raducanu', 'Thomas Tuchel', 'Jake Paul', 'Jurgen Klopp', 'Rachael Blackmore', 'Sky Brown', 'Simone Biles', 'Harry Kane', 'Antonio Conte']"
8,9,Storm Dennis,Matthew Murray,Climate change: Young activists snub award,2021-12-17,http://www.bbc.com//news/uk-wales-59690009,"Young members of an environmental group have turned down an award from a council, accusing it of not doing enough to tackle climate change.
Pontypridd's Young Friends of the Earth has been campaigning for changes to address the climate emergency. 
It said Rhondda Cynon Taf council has not done enough since the devastating floods in 2020 after Storm Dennis. 
Group member Alice, 13, said: ""It would be hypocritical for us to take the award.""
""We feel Rhondda Cynon Taf council - and the world - isn't taking action against climate change,"" she added. 
""The major changes we could do as a county would be big decisions and not small day-to-day ones. 
""Because if you sit in a house which is on fire you wouldn't just sit there as the flames surrounded you and start making a plan how you're going to deal with the fire.
""You're going to act immediately and get water and you're going to put the fire out. You wouldn't sit there doing nothing. The world isn't in the best shape and they're not doing enough about it.""
Alice added that there was ""action immediately"" when the pandemic hit, and the same needed to be done for the climate change emergency.
""We need that with climate change because if we don't get it sorted out we might not be here.""
When Storm Dennis caused widespread flooding across south Wales in February 2020, Pontypridd was one of the worst affected towns. 
Homes and businesses were hit, with the middle of the town centre flooded after the River Taff burst its banks. 
""When we saw the town flood last year we knew climate change was getting worse and despite what people were saying about it getting better because it's not,"" said Alice. 
""I felt terrified when I saw water running down the main street because if water can reach that high because of a storm, imagine what it will be like in 10 years.""
Dan, 12, another member of Young Friends of the Earth, said: ""I would have expected Rhondda Cynon Taf council to declare a climate emergency after the Welsh government did. 
""They are one of the few councils in Wales not to declare it and after Storm Dennis I'd have thought it would have been the first thing they would have done. 
""I fear, with the melting ice caps, much of the Welsh coast and RCT will get completely flooded and we'll lose whole towns and people's homes. So we need to take action so we don't lose all the history too.""
Rowan, 10, said they thought it would generate more publicity to turn down the award than accept it.
""I don't think people understand how bad things are. I find it traumatising, when I think to the future.
""I might have a future with crumbling mountains and suffocating air, and I don't want that to happen.""
Council leader Andrew Morgan replied to a letter from the group declining the award, saying the council is committed to achieving net zero by 2030 and ""has already made progress towards achieving this commitment to meet and contribute to global, national and local targets"". 
Hayley Pearce chats terrible Christmas gifts...
Follow the true story of one man's struggle to find out why his home disappeared","['Alice with loudspeaker', ""Team GB's Laura Kenny in the Tokyo velodrome"", 'Mohammed holding a magazine', 'A still image shows a frame from a video commercial for the Norwegian postal service ""When Harry Met Santa"", which features a gay Santa Claus', 'US vaccine protests', 'The army has been repeatedly accused of excesses by locals', 'Zepeto', 'Frank Mill', 'Trump speaks at a rally in July 2021', 'Man holding phone', 'Presents', 'The House That Vanished']"
9,10,Climate change,BBC News,Preston's City's carbon neutral aim poses 'financial challenge',2021-12-17,http://www.bbc.com//news/uk-england-lancashire-59696406,"A city council's aim to become carbon neutral by 2030 poses a financial challenge, a report has found.
A cross-party task group has spent almost two years exploring what Preston City Council needs to do to fulfil the pledge made in April 2019.
The report said decisions would have to be taken ensure ""the greatest carbon reduction can be achieved at the earliest opportunity"".
But its fleet of 124 vehicles will remain diesel-driven.
Councillors voted for the authority to invest a further £4.8m over the next five years in replacing the vehicles, but an accompanying report said it was not currently possible to purchase ""alternative fuelled"" vehicles, because of the lack of the necessary infrastructure to operate them.
Environment and community safety cabinet member Robert Boswell defended the decision not to shift the fleet to electric at this point, warning that if the council had to charge all of its vehicles ""there might be power failures in Preston, because there [are] other factors [to consider]"".
He suggested that the authority faced the same practical barriers to electric vehicles that were experienced by some members of the public, including a lack of charging points.
""The new vehicles that we will be moving to, though not electronic vehicles, have a reduction in emissions and have potential [for] fuel savings and more efficient engines,"" he said.
Liberal Democrat group leader John Potter branded the report ""disappointing"" and said the council would not achieve its carbon-cutting aims.
However, the Labour chair of the task group, James Hull, said it demonstrated that the authority would have a ""robust climate change agenda"" at the forefront of all its work.
The main recommendation - to create a cabinet member responsible for tackling climate change - has already been implemented by the Labour-run council back in the summer, the Local Democracy Reporting Service said.
The task group report noted the need for the council to focus on its own carbon emissions, other local emissions that it can directly influence through its policies and community emissions that can be cut through partnerships between the council and other organisations.
It also suggested that the council carries out a study to explore whether it is feasible to maximise heat recovery at the city's crematorium in order to make it more energy efficient. 
Why not follow BBC North West on Facebook, Twitter and Instagram? You can also send story ideas to northwest.newsonline@bbc.co.uk
Information about BBC links to other news sites
Hayley Pearce chats terrible Christmas gifts...
Follow the true story of one man's struggle to find out why his home disappeared","['Presentational grey line', ""Team GB's Laura Kenny in the Tokyo velodrome"", 'Mohammed holding a magazine', 'A still image shows a frame from a video commercial for the Norwegian postal service ""When Harry Met Santa"", which features a gay Santa Claus', 'US vaccine protests', 'The army has been repeatedly accused of excesses by locals', 'Zepeto', 'Frank Mill', 'Trump speaks at a rally in July 2021', 'Man holding phone', 'Presents', 'The House That Vanished']"
10,11,COP26,Steffan Messenger,Climate change: Wales COP26 events 'costly failure',2021-12-16,http://www.bbc.com//news/uk-wales-59670318,"A series of events held in Wales to coincide with the COP26 climate summit has been branded a costly ""failure"" by the Welsh Conservatives.
Figures obtained by the party show the Welsh government spent £235,000 on COP Cymru.
But the Tories claim the programme of debates and lectures resulted in little public or media interest.
The Welsh government said more than 3,800 people had attended the events online.
The series started days before the summit in Glasgow with the launch of the Welsh government's Net Zero plan - with a panel session in Port Talbot streamed live to a virtual audience.
A roadshow followed during COP26 itself- with four debate and discussion events held in different parts of Wales looking at energy, nature, climate change adaptation and transport.
This was followed by a Wales Climate Week at the end of November - a five-day programme of virtual events.  
A breakdown of the costs involved provided by the Welsh government show £53,600 was spent on staging and sound requirements, up to £135,000 on staffing and event management, £9,500 on a COP Cymru online platform, up to £23,000 on press and marketing, with about £13,490 on other costs.
Well-known Welsh presenters and journalists were invited to chair the discussions, which featured leading experts in environmental issues, as well as government ministers.
Recordings of each session have been posted online - while viewing figures are not visible, all of the videos bar one have yet to receive a single comment or ""like"".
The Tories alleged that COP Cymru had been used for ""rhetoric not action"" and had resulted in ""little to no new policy"" announcements beyond the initial Net Zero plan.  
Their climate change spokesperson in the Senedd, Janet Finch-Saunders MS said the whole thing had been a ""failure"".
""It's highly disappointing that hard earned taxpayer money was spent on events that were little more than self-promotion and ego stroking,"" she said. 
She claimed funding had been ""frittered away"" and that it would have been better spent on shoring up coal tips, which was ""such a priority for the people of Wales"".
But climate scientist Professor Mary Gagen of Swansea University said aspects of the criticism had ""made her blood boil"".
She was involved in several COP Cymru events, as well as producing a guide for Welsh schools on climate change and videos showcasing the efforts of university researchers in the field.
""What I thought was a real shame was saying that, because these weren't flashy media events that they weren't inspiring and weren't able to make a difference,"" she said.
""It's the exact opposite - what leads to positive change are those little moments where a school child is able to meet with a scientist, where a farmer is able to ask a question, they're never going to make the front page but they're really meaningful.
""For me COP Cymru generated thousands and thousands of those moments.""
Dr Anna Bullen of the Centre for Alternative Technology who also chaired one of the events said the livestreaming element made it ""hard to gauge"" how they were being received.
""Of course I want to see as much public engagement as possible but I wouldn't use that as a sole reason to end an event like this.""
""For our sector bringing together practitioners and experts, sharing views, understanding and research is so important,"" she said.
A spokesperson for the Welsh government said COP Cymru included an extensive programme of events, attracting more than 3,800 virtual attendees, 200 speakers and 38 sessions.
""Several fringe events were also held as there was too much demand for content to fit into a single programme,"" they said.
He added that if the government was to meet its net zero targets it was ""crucial we engage with people, businesses and organisations across Wales"".
""COP26 provided an international platform to show Wales is playing its part in tackling the threats of climate change and that we are listening and learning from experiences elsewhere,"" they said.
""COP Cymru brought the conversation closer to home and was an important opportunity to engage citizens across Wales, helping them understand the need for collective action and the role they can play."" 
On coal tip safety, he added it was the UK Government that was ""unwilling to take responsibility"" for the restoration work costs, currently estimated to be at least £500m.  
Hayley Pearce chats terrible Christmas gifts...
Follow the true story of one man's struggle to find out why his home disappeared","['Around the BBC iPlayer footer', ""Team GB's Laura Kenny in the Tokyo velodrome"", 'Mohammed holding a magazine', 'A still image shows a frame from a video commercial for the Norwegian postal service ""When Harry Met Santa"", which features a gay Santa Claus', 'US vaccine protests', 'The army has been repeatedly accused of excesses by locals', 'Zepeto', 'Frank Mill', 'Trump speaks at a rally in July 2021', 'Man holding phone', 'Presents', 'The House That Vanished']"
